Problema,URL
Geladeira não gela? Geladeira não está gelando?,https://www.brastemp.com.br/atendimento/perguntas-frequentes/geladeira-nao-gela
A lâmpada da Geladeira queimou e não acende. E agora?,https://www.brastemp.com.br/atendimento/perguntas-frequentes/a-lampada-nao-acende-o-que-fazer
A Geladeira não liga: O que fazer?,https://www.brastemp.com.br/atendimento/perguntas-frequentes/a-geladeira-nao-liga-o-que-fazer
Luz do painel de controle da geladeira piscando,https://www.consertogeladeirabh.com.br/blog/luz-do-painel-de-controle-da-geladeira-piscando
Por que o micro-ondas não liga?,https://www.brastemp.com.br/atendimento/perguntas-frequentes/por-que-o-micro-ondas-nao-liga
O que fazer quando o micro-ondas Electrolux não liga?,https://cuida.electrolux.com.br/artigos/o-que-fazer-micro-ondas-electrolux-nao-liga
Vazamento de Água: Como Resolver e Como Evitar,https://conexao.amancowavin.com.br/blog/vazamento-de-agua-como-resolver-e-como-evitar
Como consertar torneira pingando: confira o passo a passo,https://www.lojadomecanico.com.br/blog/como-consertar-torneira-pingando/?srsltid=AfmBOooG6qJSYGYtE_xSXPfAzwYe7FQW1DwVcnupsGfmV8v6HOZbVm5G
Como desentupir pia de cozinha: confira as 10 melhores dicas,https://blog.leroymerlin.com.br/como-desentupir-pia/
Como desentupir ralo de banheiro: produtos e procedimentos,https://blog.leroymerlin.com.br/como-desentupir-ralo-de-banheiro/
Serviços para Casa e Auto porto seguto, https://www.portoseguro.com.br/servicos